{
  "benchmark_implementation_commit": "eb73c0115c2cfc0319fff1f0e4dba0a55ab3c1f7",
  "bundle_digest": "bdcf8f2bd80ab51948b3ecf521b746a359b155759b5e8493b537e24f043d05e0",
  "canonicalization": "json-sort-keys-compact-v1",
  "environment": {
    "benchmark_mode": "sequential",
    "logical_cpu_count": 8,
    "machine": "arm64",
    "python_version": "3.13.12",
    "remote_llm_inference": false,
    "system": "Darwin",
    "system_release": "25.5.0"
  },
  "generated_at": "2026-08-11T13:50:45.329655Z",
  "kind": "verifiable-ai-governance/release-runtime-benchmark",
  "policy": {
    "digest": "72f6fc7dc6303f4fd1b78dadfd6befcec8f909aa750542a6d283697802a03efb",
    "path": "config/release-runtime-slo-policy.json",
    "profile": "local-reference-v1"
  },
  "raw_measurements": {
    "path": "artifacts/release/benchmark/runtime-benchmark-raw.json",
    "sha256": "9a29b6d8e4af4fa2ce55d66f58d409e00663102295b618bf17fdd1f80e2f052e",
    "size_bytes": 25672
  },
  "release_version": "0.2.0-rc2",
  "runtime_equivalence": {
    "benchmark_commit": "eb73c0115c2cfc0319fff1f0e4dba0a55ab3c1f7",
    "changed_path_count": 19,
    "release_commit": "ef2c447e71638ee1cb0bedc6f39afd30bf8ba152",
    "runtime_changed_paths": [],
    "runtime_equivalent": true
  },
  "scenarios": {
    "governance_ready": {
      "slo": {
        "checks": {
          "max_error_rate": true,
          "max_p95_ms": true,
          "max_p99_ms": true,
          "min_observed_rate_per_second": true,
          "minimum_samples": true
        },
        "thresholds": {
          "max_error_rate": 0.0,
          "max_p95_ms": 250.0,
          "max_p99_ms": 500.0,
          "min_observed_rate_per_second": 4.0,
          "minimum_samples": 50
        },
        "verdict": "pass"
      },
      "summary": {
        "error_count": 0,
        "error_rate": 0.0,
        "max_ms": 24.532042,
        "mean_ms": 13.07292994,
        "min_ms": 10.895916,
        "observed_rate_per_second": 76.49394623773223,
        "p50_ms": 12.175125,
        "p95_ms": 19.338708,
        "p99_ms": 24.532042,
        "sample_count": 50
      }
    },
    "governed_routing_allowed": {
      "slo": {
        "checks": {
          "max_error_rate": true,
          "max_p95_ms": true,
          "max_p99_ms": true,
          "min_observed_rate_per_second": true,
          "minimum_samples": true
        },
        "thresholds": {
          "max_error_rate": 0.0,
          "max_p95_ms": 750.0,
          "max_p99_ms": 1500.0,
          "min_observed_rate_per_second": 1.0,
          "minimum_samples": 50
        },
        "verdict": "pass"
      },
      "summary": {
        "error_count": 0,
        "error_rate": 0.0,
        "max_ms": 53.435208,
        "mean_ms": 45.675077460000004,
        "min_ms": 39.911834,
        "observed_rate_per_second": 21.89377786771683,
        "p50_ms": 45.224166,
        "p95_ms": 51.449875,
        "p99_ms": 53.435208,
        "sample_count": 50
      }
    },
    "runtime_assurance_evaluation": {
      "slo": {
        "checks": {
          "max_error_rate": true,
          "max_p95_ms": true,
          "max_p99_ms": true,
          "min_observed_rate_per_second": true,
          "minimum_samples": true
        },
        "thresholds": {
          "max_error_rate": 0.0,
          "max_p95_ms": 1500.0,
          "max_p99_ms": 3000.0,
          "min_observed_rate_per_second": 0.5,
          "minimum_samples": 10
        },
        "verdict": "pass"
      },
      "summary": {
        "error_count": 0,
        "error_rate": 0.0,
        "max_ms": 5.649291,
        "mean_ms": 5.059077,
        "min_ms": 4.411959,
        "observed_rate_per_second": 197.6645146930952,
        "p50_ms": 5.0625,
        "p95_ms": 5.603333,
        "p99_ms": 5.649291,
        "sample_count": 20
      }
    },
    "runtime_control_state_read": {
      "slo": {
        "checks": {
          "max_error_rate": true,
          "max_p95_ms": true,
          "max_p99_ms": true,
          "min_observed_rate_per_second": true,
          "minimum_samples": true
        },
        "thresholds": {
          "max_error_rate": 0.0,
          "max_p95_ms": 150.0,
          "max_p99_ms": 300.0,
          "min_observed_rate_per_second": 5.0,
          "minimum_samples": 50
        },
        "verdict": "pass"
      },
      "summary": {
        "error_count": 0,
        "error_rate": 0.0,
        "max_ms": 9.5045,
        "mean_ms": 4.46963338,
        "min_ms": 3.029833,
        "observed_rate_per_second": 223.73199656030846,
        "p50_ms": 4.200667,
        "p95_ms": 6.404334,
        "p99_ms": 9.5045,
        "sample_count": 50
      }
    },
    "runtime_telemetry_query": {
      "slo": {
        "checks": {
          "max_error_rate": true,
          "max_p95_ms": true,
          "max_p99_ms": true,
          "min_observed_rate_per_second": true,
          "minimum_samples": true
        },
        "thresholds": {
          "max_error_rate": 0.0,
          "max_p95_ms": 500.0,
          "max_p99_ms": 1000.0,
          "min_observed_rate_per_second": 2.0,
          "minimum_samples": 50
        },
        "verdict": "pass"
      },
      "summary": {
        "error_count": 0,
        "error_rate": 0.0,
        "max_ms": 16.242333,
        "mean_ms": 4.5145491,
        "min_ms": 3.230833,
        "observed_rate_per_second": 221.50606358451168,
        "p50_ms": 3.906333,
        "p95_ms": 11.107625,
        "p99_ms": 16.242333,
        "sample_count": 50
      }
    }
  },
  "schema_version": "1.0",
  "upstream_roots": {
    "build_provenance_digest": "eb30e80969c827f568a83e105af9e705c98af4f3ec3ab971f0c61bda3c7346c1",
    "release_manifest_digest": "0f3dec44b3db519de74745f9dd39ee7c0995dc05706635baf25aefd1a2422c0b",
    "security_bundle_digest": "163a5274cc59268ae59f7888a03540358a9a798fd09abdf989f8c8013838fdbd"
  },
  "verdict": "pass"
}
